Name,Department,Date,Title,Review,Rating
Asklepios Fachklinikum Göttingen,Suchttherapie,03.12.2017,"Nicht so schlecht, wie oft dargestellt...","['Ich habe die Klinik in den letzten 25 Jahren mehrfach besucht und versch. Stationen durchlaufen. Zunächst die 12.2 (alte 12.2 (Sucht), die heutige 4.2) mehrfach, später die 5.1. und letztmalig 2016 die 4.1. (die heutige 4.1. (Sucht), die ehemalige 11.2). Keiner dieser Aufenthalte war schlecht. Die folgende Bewertung bezieht sich ausschl. auf den 2016er Aufenthalt.  Eigentlich sollte ich nur für 3-4 Tage für einen Medikamentenwechsel bleiben, habe mich jedoch nach einem Gespräch mit dem sehr frdl. Stationsarzt für eine alternative Behandlung entschieden, die 3,5 Wochen in Anspruch nahm. Die Stat. 4.1. ist eigentl. für jüngere Leute (18-25) konzipiert, die ein Problem mit sog. Partydrogen haben. Teilw. wird aber auch mit ""älterern Kalibern"" wie mir (Mitte 40) aufgestockt. Die Unterbringung erfolgt ausschl. in 2-Bett-Zimmern (wie auf fast allen anderen Stationen auch, mit Ausnahme z.B. 9 und 11.1). Ich bin eher der Einzelzimmerfreund, aber wenn man einen korrekten Zimmernachbarn hat, ist es O.K. (man kann auch untereinander umziehen, wenn es gar nicht passt). Ich hatte vom ersten Tag an unbegl. Ausgang, was auf einer Suchtstation nicht selbstverständlich ist (saubere UK ist Voraussetzung), von tägl. 3 Std. (wobei nicht auf die Min. geachtet wird). Medikation konnte ich mehr oder weniger selbst bestimmen, in Absprache mit dem Stat.-Arzt. Das Personal auf der Station ist soweit freundlich und umgänglich. Einzige Kritik, die ich mit den anderen Bewertern teile, ist dass die Pfleger-/innen oft gleichzeitig Pause machen (im Pausenraum auf der Stat.), so dass teilweise längere Zeit niemand ansprechbar ist ausser im Notfall. Die Oberärztin ist auch in Ordnung. Die zust. Chefärztin ist super. Sie hatte zwar gerade Urlaub als ich dort war, aber ich kenne sie von anderen Aufenthalten sehr gut. Freizeitangebote wurden leider sehr zusammengestrichen. Mitpatienten von außerhalb Göttingens waren sehr angetan vom Suchtbereich des Askl. im Vergleich zu anderen Kliniken. Gerne wieder!!']","['', '', 'Gesamtzufriedenheit:', 'zufrieden (Würde jederzeit wieder in den Suchtbereich gehen)', '', 'Qualität der Beratung:', 'zufrieden (Bekam ausreichend Erklärungen und auf jede Frage eine Antwort)', '', 'Mediz. Behandlung:', 'zufrieden (War so wie ich es mir vorgestellt habe)', '', 'Verwaltung und Abläufe:', 'sehr zufrieden (Kurz, schnell und Reibungslos)', '', 'Ausstattung und Gestaltung:', 'weniger zufrieden (auf der 4.1. haben nur 3 oder 4 Zimmer eigenes Bad, Freizeitangebote über die Jahre sehr, sehr gekürzt.)', '', '', '']"
Asklepios Fachklinikum Göttingen,Psychiatrie,16.10.2017,Man darf nicht alles zu eng sehen,"['Ich war gerade 6 Wochen auf Station 12.2.', 'Die Therapieangebote sind kurz gehalten, da man sich mit sich selbst auseinander setzen soll.', 'Sehr positiv empfand ich die Einzeltherapie. Alle Therapeutinnen machen ihre Arbeit toll. ', 'Auch die DBT Gruppentherapie ist sehr gut.', 'Das ich ein Einzelzimmer hatte mit Bad war auch positiv.', 'Negativ ist leider der Geräuschpegel auf der Station. Leider alles sehr hellhörig und auch die Station darunter hört man, wenn Stühle gerückt werden.', 'Die Achtsamkeitsgruppe wird vom Pflegepersonal geleitet, genauso wie die Skill- und Qi Gong Grupoe. Ist nicht immer das , was man sich wünscht. Für mich war es nur ein "" Nebenschauplatz"". Diese Gruppen sollten jedoch von qualifizierten Therapeuten geleitet werden meiner Meinung nach.', 'Leider können die Zimmer nicht abgeschlossen werden und es gibt keinen Ausweichraum, wenn es auf dem Zimmer mal zwischen Patienten ""knallt"". ', 'Leider gibt es keine Massagen oder Feldenkrais für die Patienten.', 'Mein Fazit....Es ist nicht alles schlecht und nicht alles gut. Aber mir hat es was gebracht und ich werde bald wieder dort mein Zimmer beziehen.']","['', '', 'Gesamtzufriedenheit:', 'zufrieden', '', 'Qualität der Beratung:', 'zufrieden', '', 'Mediz. Behandlung:', 'zufrieden', '', 'Verwaltung und Abläufe:', 'unzufrieden', '', 'Ausstattung und Gestaltung:', 'weniger zufrieden', '', '', '']"
Asklepios Fachklinikum Göttingen,Psychiatrie,01.10.2017,Willi,['Die Fachärzte und Pflegepersonalwaer sehr gut von Station 5.3. Aufnahme ging sehr zügig ohne Wartezeit. Essen ??'],"['', '', 'Gesamtzufriedenheit:', 'sehr zufrieden', '', 'Qualität der Beratung:', 'zufrieden', '', 'Mediz. Behandlung:', 'sehr zufrieden (Die Ärzte und Pflegepersonal haben mehr ahnung als man zu einer Reha fährt)', '', 'Verwaltung und Abläufe:', 'zufrieden (Schnelle Abwicklung Kaum Wartezeitn)', '', 'Ausstattung und Gestaltung:', 'weniger zufrieden (Die Zimmer Könten Größer sein)', '', '', '']"
Asklepios Fachklinikum Göttingen,Psychiatrie,30.09.2017,"Konzept und Umsetzung sehr gut, Hygiene und Organisation mangelhaft","['Ich war eine Woche auf der Sation 10 (Alkoholentgiftung) und 6 Wochen auf Station 11.1 (Sucht- und Traumafolgebehandlung).', '', 'Zur Station 10 kann ich aufgrund des kurzen Aufenthaltes nur wenig berichten. Das ""offene"" Modell der Station empfand ich als sehr gut. Das Pflegepersonal war zum größten Teil in Ordnung. Essen gibt es auf der Station. Die Ausstattung ist mangelhaft (besonders Badezimmer), genauso wie die Hygiene. Es gibt keine regulären Einzelzimmer.', '', '', 'Station 11.1 ist gut. Auch wenn es ebenfalls massiv an der Hygiene mangelt. Die Putzkräfte veteilen den Schmutz, so habe ich mehrfach (!) fremde Haare in meinem Zimmer und im Waschbecken vorgefunden. Die Toiletten (3 geschlechter unspezifisch, 1 jeweils nur für Männer bzw. Frauen, insgesamt 5) werden nicht ausreichend gereinigt. Es gibt keinerlei Möglichkeit der Händedesinfektion, obwohl auf dieser Station Patienten mit ansteckenden Krankheiten, wie Hepatitis oder HIV verkehren. Die selbstständige Desinfektion mit handelsüblichen Mitteln wird angeraten.', '', 'Therapiekonzept ist sehr gut, ebenso die fachärztliche-, pflegerische- und psychotherapeutische Betreuung. Es finden in der Regel 2 Einzeltermine mit dem/der Bezugstherapeut/-in wöchentlich statt. Einmal wöchentlich findet die Chefarztvisite statt. Daneben gibt es ein breites Spektrum an therapiebegleitenden Anwendungen wie Meditation, Yoga, Imagination, Traumreisen, Einzelskills-Training, Sport, Körpertherapie und mehr. ', '', 'Auf der 11.1 gibt es ausschließlich (sehr kleine) Einzelzimmer. Diese erfüllen ihren Zweck. Geraucht wird in einem ""Wintergarten"", dies ist rund um die Uhr möglich. ', '', 'Die Station schließt um 22 Uhr, danach ist keinerlei Ausgang mehr möglich, Mittagessen wird in der klinikeigenen Mensa eingenommen, andere Mahlzeiten sind selbstständig planbar, die stationseigene Küche ist wochentags bis 22 Uhr nutzbar und ausreichend ausgestattet.', '', 'Es gibt 2 Fernseh- bzw. Aufenthaltsräume, Patientenkühlschränke und 2 nutzbare Computer inkl. Drucker.']","['', '', 'Gesamtzufriedenheit:', 'zufrieden', '', 'Qualität der Beratung:', 'sehr zufrieden', '', 'Mediz. Behandlung:', 'zufrieden', '', 'Verwaltung und Abläufe:', 'weniger zufrieden', '', 'Ausstattung und Gestaltung:', 'unzufrieden', '', '', '']"
Asklepios Fachklinikum Göttingen,Suchttherapie,10.07.2017,Enttäuschung,"['Die Aufnahme war soweit ganz ok. Ausser das ich nicht richtig gefilzt wurde.Das heißt jeder Süchtel kann(und fast jeder tut dies auch)Drogen mit auf die Station bringen. Als mir mein Zimmer zugewiesen wurde, wurde ich noch bevor ich meine Sachen richtig in meinen Schrank einräumen konnte von meinem Zimmernachbarn nach Haschisch gefragt.Ich verneinte und sagte ihm er könne doch hier raus und zum Bahnhof gehen. Dort gibt es alles. Er lachte nur.Später wußte ich warum. Ich stellte mir die Frage warum Urinkontrollen gemacht werden. Auf dem Raucherbalkon roch es abends ständig nach Haschisch. Die Ersatzdrogen(für den angeblichen Entzug) wurden regelrecht untereinander getauscht.Das ging natürlich nur mit festen Mitteln :-). Um nicht auseinandergenommen zu werden hat man schön die Klappe gehalten. Es gabt Patienten die haben abends auf ihren Zimmern gekifft. Was soll das? Geht es der Klinik nur um Kohle? Wer wirklich Schluß machen will mit Drogen und Alkohol ist hier völlig Fehl am Platz. Das Personal ist auch sehr unterschiedlich. Sehr nett und dann wieder andere unangenehm böse. Gerade dass junge Personal ist sehr , sehr unhöflich.Kaum Zeit, weil das Handy wichtiger scheint. Ständig patzige Antworten. Die allgemeine Sauberkeit ist grauenhaft.Das Essen ist unterster Standard. Und selten bekommt man das was man bestellt hat.Dass die Menschen die hier her kommen keine Engel sind ist wohl klar. Aber wie Müll muss man sie nicht behandeln. Einige wollen ja tatsächlich Hilfe. Gewaltandrohungen sind an der Tagesordnung. Ich kam hier her um Ruhe zu finden!!! Rechtsradikale Musik wird toleriert und Agro-Rap. Patienten richten sich die Aufenthalt-Fehrsehsräume als privat Räume ein. Völlig vermüllt!Eine sehr erschreckende Erfahrung meinerseits... Danke , nie wieder!!!']","['', '', 'Gesamtzufriedenheit:', 'unzufrieden (s.o)', '', 'Qualität der Beratung:', 'weniger zufrieden (unwichtig)', '', 'Mediz. Behandlung:', 'weniger zufrieden (zu kurze Gespräche)', '', 'Verwaltung und Abläufe:', 'weniger zufrieden (zu langsam)', '', 'Ausstattung und Gestaltung:', 'unzufrieden (viel kaputt , Schmutz)', '', '', '']"
Asklepios Fachklinikum Göttingen,Psychiatrie,09.07.2017,Psychiatrie,"['Die Aufnahme auf der Station 1.1.bzw 1.2 ist hervorragend. Zu der Statino 5.1 kann ich aus eigener Erfahrung sagen, hier würd einem wirklich geholfen. Mann sollte nur bei einer Verlegung darauf achten, dass man nicht auf die Station 7 verlegt würd. Denn da gibt es eine möchte gern Therapeutin. Diese ist nicht in der Lage auf kranke Menschen einzugehen. Dies Station 7 ist in jeder Hinsicht zu meiden.']","['', '', 'Gesamtzufriedenheit:', 'weniger zufrieden', '', 'Qualität der Beratung:', 'weniger zufrieden', '', 'Mediz. Behandlung:', 'unzufrieden', '', 'Verwaltung und Abläufe:', 'unzufrieden', '', 'Ausstattung und Gestaltung:', 'weniger zufrieden', '', '', '']"
Asklepios Fachklinikum Göttingen,Psychiatrie,12.06.2017,"Unfassbare Zustände: Zwangsmaßnahmen, Erpressung Fehldiagnosen, Zwangsmedikation, Arroganz des Personals, Wichtigtuerei, Zeitmangel, Desinteresse ...","['Boykottiert Asklepios und klagt gegen diesen Konzern ', '', 'https://www.asklepios.com/konzern/unternehmen/ueber-uns/gesellschafter/', '', 'Alle weiteren Zusammenhänge kann man bei Interesse googlen ... einfach menschenverachtend  und ekelhaft ... ', '', 'http://www.goettinger-tageblatt.de/Goettingen/Uebersicht/Bericht-Bei-Verkauf-der-LKH-Goettingen-rechtliche-Vorschriften-verletzt', '', 'http://www.goettinger-tageblatt.de/Goettingen/Uebersicht/Verbreitung-von-Tageblatt-Bericht-Tricks-vom-Klinik-Konzern-Asklepios', '', 'Für einen Appel und ein Ei vom Staat ""gekauft"" und seitdem scheffelt dieser Gutmensch Milliarden auf Kosten der Patienten ... Beschwerden des Personals und der Patienten werden ignoriert', 'http://www.goettinger-tageblatt.de/Goettingen/Uebersicht/Asklepios-Aerzte-gegen-Geschaeftsfuehrung ', '', 'und die Meinungs- und Pressefreiheit werden per ""Gerichtsbeschluss"" verhindert ', '...http://www.goettinger-tageblatt.de/Goettingen/Uebersicht/Asklepios-geht-gegen-Tageblatt-vor ', '', 'Ich kann nur davon abraten, IRGENDEINE Asklepios-Klinik aufzusuchen ...']","['', '', 'Gesamtzufriedenheit:', 'unzufrieden', '', 'Qualität der Beratung:', 'unzufrieden (keine Beratung, keine Gespräche, einfach nur schlecht)', '', 'Mediz. Behandlung:', 'unzufrieden (abartig und menschenverachtend, wie im Gefängnis)', '', 'Verwaltung und Abläufe:', 'zufrieden (die haben wenigstens ihre Arbeit gemacht)', '', 'Ausstattung und Gestaltung:', 'zufrieden (bis auf das ""therapeutische"" Personal auf den Stationen waren alle sehr nett)', '', '', '']"
Asklepios Fachklinikum Göttingen,Psychiatrie,08.06.2017,Unter aller Sau,"['Mein Vater lag auf der 3.1 , er hatte nach einem Unfall während der Op einen Schlaganfall erlitten und leidet seit dem an einer Demenz. In der Betreuung zeigte er aggressive Züge und wurde eingewiesen. Als ich ihn das erste mal besuchte sah er noch halbwegs menschlich aus, zwar unrasiert, aber ich habe ihn erkannt und er mich. Das Zimmer war sauber, das Bad auch so halbwegs. Sonst war alles weggeschlossen. Meine Bitte, ihm seinen elektrischen Rasierer zu bringen ignorierte man. Naha, eine Woche später kam meine Mutter, Schwester, Enkelkind zu Besuch. Er lag, nur mit einet Windel!!! bekleidet im Bett, der Stuhl var von einem anderen Bewohner vollgesch...., der Mülleimer quoll über, das Bad war dreckig, er hatte noch nicht mal ein Handtuch. Auf Nachfrage, warum er nackt und das Zimmer ein Saustall ist, kam die Antwort, wir haben ja nicht gewusst das sie kommen. Was soll das??? Auch an Demenz erkrankte sind Menschen. Wie kann man sie nur so behandeln? Er kommt schlimmer raus, als er rein gegangen ist. Selten so einen Saustall erlebt. Es sind eure Kunden, ihr werdet von unser aller Geldern bezahlt. Macht eure Arbeit vernünftig oder hört auf. Ich bin entsetzt, das in unserer heutigen Zeit so etwas passiert. Schlimmer als im Mittelalter. Bin echt am überlegen, ob man das nicht öffentlich publik machen sollte. Hochnäsiges, menschenverachtendes Verhalten. Es gibt nur ein Wort, Sauhaufen. Danke für nix.']","['', '', 'Gesamtzufriedenheit:', 'unzufrieden', '', 'Qualität der Beratung:', 'unzufrieden', '', 'Mediz. Behandlung:', 'unzufrieden', '', 'Verwaltung und Abläufe:', 'weniger zufrieden', '', 'Ausstattung und Gestaltung:', 'unzufrieden', '', '', '']"
Asklepios Fachklinikum Göttingen,Psychiatrie,18.04.2017,"Von ""Trauma""-Therapie ist abzuraten","['Von der Traumatherapie ist leider abzuraten.', '', 'Das aktuelle Konzept auf der Station 12.2 hat leider nichts mehr mit einer hochwertigen Traumatherapie zu tun. Es wird nicht mehr nach dem Konzept von Herrn Sachsse und Reddemann gearbeitet! Die Therapie wurde in Quantität und Qualität minimalisiert.', '', '', '', 'Eine hochwertige Traumatherapie muss folgende Mindeststandards erfüllen:', '* Einzelzimmer für alle, um den Stresslevel möglichst niedrig zu halten', '* Achtsamkeit, Qi-Gong, PMR usw. nur von entsprechend qualifiziertem Personal', '* Traumaspezifische Ergotherapie und Körperwahrnehmung', '* Imagination von entsprechend qualifiziertem Personal', '* Traumaspezifischer Gesamtbehandlungsplan und traumaspezifische Therapien', '* Frühzeitige Trauma-Psychoedukation', '* Traumaspezifisches Skilltraining', '* usw.', '', 'Auf der Station 12.2 werden alle Doppelzimmer mit zwei Patienten belegt (In Bielefeld wird dies zum Beispiel nicht gemacht). Achtsamkeit, Qi-Gong, Imagination wird von den Pflegefachkräften durchgeführt. Ob sie alle die hierfür notwendige Qualifikation haben ist fraglich. Die Pflegefachkräfte sind dabei auch gleichzeitig für die Station zuständig und telefonieren dann auch mal. Die Ergotherapie, Frühsport, Körperwahrnehmung sind nicht traumaspezifisch.Es gibt nur eine Schulung für Trauma-Psychoedukation und DBT-Training. Der Patient muss also dort einsteigen wo die Gruppe sich gerade befindet. Wer Pech hat, bekommt überhaupt keine Trauma-Psychoedukation. Das Skript basiert auf DBT und wurde nur leicht angepasst.', '', 'Es gibt keine Gruppenregeln im zwischenmenschlichen Bereich.', 'Wird eine Patientin von einer anderen getriggert, wird dies nicht ernst genommen.', 'Ist ein Patient gegenüber anderen aggressiv, wird dies ebenfalls ignoriert.', 'Viele Patienten sind auf Grund der Zimmerbelegung übernächtigt und schlecht gelaunt. ', 'Es kann passieren, dass man das Zimmer mit jemandem mit Borderline teilen muss. Dies kann sehr belastend sein.']","['', '', 'Gesamtzufriedenheit:', 'unzufrieden', '', 'Qualität der Beratung:', 'unzufrieden', '', 'Mediz. Behandlung:', 'unzufrieden', '', 'Verwaltung und Abläufe:', 'unzufrieden', '', 'Ausstattung und Gestaltung:', 'unzufrieden', '', '', '']"
Asklepios Fachklinikum Göttingen,Psychosomatik,27.03.2017,Nicht mehr empfehlenswert,"['War von 2015 - 2016 zu vier Intervallen in der Klinik auf Station 9. Und nach dem letzten Intervall kann ich bestätigen was mit Absolutismus gemeint ist. Ichhatte die ersten drei Intervalle sehr  heilsame Erfahrungen gemacht und auch sehr viele Fortschritte. Das letzte Intervall lief total schief, weil ich wegen familärer Probleme zu instabil war. Das ist mein Teil. Aber ich habe eine enorme Verschlechterung der Qualität der Station erlebt. Weniger Personal und eine sehr abgearbeitete Therapeutim, die mich dann im letzten Gespräch im Grunde raußschmiss, weil ich angeblich bei jedem Intervall die Erwachesene bei Klinikeintriit an der Tür abgegeben hätte... und ich den Ansprüchen der Station nicht genügen würde. Bei meiner verzweifelten Frage was ich denn machen könne, kamen keine konstruktiven Vorschläge.(Ich dachte Schwarz-Weiß-Denken ist ein Symptom der PTBSß!) ', 'Ich wurde einfach raussgeschmissen und total hängen gelassen. Also wer in diese Klinik geht, sollte es zu jeder Minute beherrschen stabil zu bleiben. Für mich wurde das Unterscheiden vom Kind-State und dem Erwachsenenanteil zu einer absoluten und engstiernigen Haltung wo eine gewisse Menschlichkeit verloren gegangen ist, was sicherlich auch mit den finanziellen Einsparungen von Asklepios und der Überlastung des Personals zu tun hat. Das ist alles sehr schade, denn die haben dort wirklich viel Erfahrung und Kompetenz.Ach ja, es fallen auch viele Angebote wie feldenkreis, Ergotherapie, Körpertherapie sehr oft aus und das ist nicht gerade förderlich für die Genesung. Manchmal hat man außer den Qi-Gong-Übungen am Morgen ein bis zwei Tage gar nichts.']","['', '', 'Gesamtzufriedenheit:', 'weniger zufrieden', '', 'Qualität der Beratung:', 'weniger zufrieden', '', 'Mediz. Behandlung:', 'weniger zufrieden', '', 'Verwaltung und Abläufe:', 'zufrieden', '', 'Ausstattung und Gestaltung:', 'zufrieden', '', '', '']"
Asklepios Fachklinikum Göttingen,Psychosomatik,15.03.2017,"""Ärzte Phobie"" - Entweder chirurgischer Eingriff eines ablingenden Abzesses oder keine Weiterbehandlung","['Mit Aufnahmetag war ich 2 Tage da ...', '', 'Anscheinend stimmen die Bewertungen über die Askpelios Göttingen, die im Internet öffentlich einzusehen sind ...', 'Wegen Verweigerung eines chirurgischen Eingriffs eines abklingenden Abzesses aus psychologischer u.a. einer ""Ärzte Phobie"" Behandlung wegen entlassen...', 'Nach jahrerlanger Probleme mit Ärzte, bzw. Vermeidung von Ärzten', 'mit direktem Kontakt bzw. Eingriff in und an meinem Körper, habe', 'ich es geschafft, mich stationär u.a. wegen einer ""Ärzte Phobie"" behandeln wollen zu lassen.', 'Ich wurde nach 2 Tagen entlassen, weil ich einen ""ablingenden"" Abzess auf dem Rücken hatte und eine chirurgische Spaltung abgelehnt habe, die ich aus Erfahrungen in der Vergangenheit diese Stufe kenne, und beurteilen konnte, daß die Situation unter Tabletteneinnahme und entsprechende Salbenverbände im Griff ist.', 'Die mittlerweile alle Ärzte, Vorort, wo auch immer', 'die auf einmal aufgetaucht sind, haben mir eine Weiterbehandlung NUR MIT CHIRURGSCHEN EINGRIFF gewährt.', 'Wie mit einer ""Ärzte Phobie""!???', 'Derzeitige Situation:', 'Abzess war offen, Flüssiges konnte also raus...', 'Entzündung & Druckschmerz waren weg...', 'Einnahme von Antibiotikum vorhanden', 'Verlangt wurde ""Eingriff"" sonst keiner psychologische Weiterbehandlung der z.B. Ärzte-Phobie ...', 'Jawoll ... Das nenne ich ""Abschuß"" mit Qualität!!!', '... übrigens... wird das Folgen haben ...']","['', '', 'Gesamtzufriedenheit:', 'unzufrieden', '', 'Qualität der Beratung:', 'zufrieden', '', 'Mediz. Behandlung:', 'unzufrieden', '', 'Verwaltung und Abläufe:', 'zufrieden', '', 'Ausstattung und Gestaltung:', 'zufrieden', '', '', '']"
Asklepios Fachklinikum Göttingen,Psychiatrie,17.02.2017,"Beschwerde,Feststellung","['ich war Patient ', 'nach meiner Meinung ist die Behandlung mit Medikamenten falsch weil die Stimmen von Außen kommen.', 'Vielleicht sollte man Heilpratiker einsetzen.']","['', '', 'Gesamtzufriedenheit:', 'weniger zufrieden', '', 'Qualität der Beratung:', 'unzufrieden', '', 'Mediz. Behandlung:', 'weniger zufrieden', '', 'Verwaltung und Abläufe:', 'weniger zufrieden (schwer zu beurteilen)', '', 'Ausstattung und Gestaltung:', 'weniger zufrieden (kein Pay)', '', '', '']"
Asklepios Fachklinikum Tiefenbrunn,Psychosomatik,17.02.2021,Dank und Lob an die Station PRIVITA,"['Ich habe zum zweiten Mal eine lange Zeit in Tiefenbrunn in der Station PRIVITA verbracht.', '', 'Auch dieses Mal bin ich mit der Behandlung, dem Therapiekonzept, den Komfortzimmern, der Verpflegung, dem herzlichen und professionellen Miteinander auf der Station mehr als zufrieden.', '', 'Das Behandlungskonzept ist individuell auf die eigenen Bedürfnisse abgestimmt und immens hilfreich, wenn man sich darauf einlässt. ', '', 'Die Ärzte, Therapeuten, Physiotherapeuten, Mitarbeiter, die mich behandelten, insbesondere meine behandelnde Ärztin, sind professionell, interessiert, einfühlsam, unterstützend, hilfreich und kommunizieren auf Augenhöhe. Auch das gesamte Pflegepersonal ist mit Lob zu erwähnen. Dort findet man immer ein offenes Ohr.', 'Jeder ist mit seiner Art, Charme, Witz und Einfühlungsvermögen voll bei der Sache. Danke dafür! ', '', 'Für mich war die Zeit in der PRIVITA eine gute, gelungene, erholsame und hilfreiche Auszeit aus dem Alltag. Ich habe viel gelernt und für mich mitgenommen. Auch wenn es oftmals nicht einfach ist und auch durchaus wehtut sich derart intensiv mit sich und seinem Leben auseinanderzusetzen, ist es doch der beste Weg für positive Veränderung, Verständnis für sich selbst und auch Mitmenschen zu erreichen und seinem Leben mit anderer Sichtweise begegnen zu können.', '', 'Ich kann die PRIVITA nur weiterempfehlen und mich nochmals für alles bedanken.', '', 'Machen Sie alle weiter so!']","['', '', 'Gesamtzufriedenheit:', 'sehr zufrieden', '', 'Qualität der Beratung:', 'sehr zufrieden', '', 'Mediz. Behandlung:', 'sehr zufrieden', '', 'Verwaltung und Abläufe:', 'sehr zufrieden', '', 'Ausstattung und Gestaltung:', 'sehr zufrieden', '', '', '']"
Asklepios Fachklinikum Tiefenbrunn,Psychiatrie,21.12.2020,Abbruch Therapie Sonnenhaus,"['Ich war vor Jahren als Patientin im Sonnenhaus.', 'Mein Hauptproblem war meine panische Angst vor Männern', '', 'Eigentlich hatte ich mich dort gut gefühlt und dachte, dass ich meine Angst bewältigen könnte.', 'Die Ärzte und Pfleger waren echt okay. Nahmen total Rücksicht.', '', 'Dann teilte mir eines abends eine schlecht gelaunte Schwester mit, dass ich gefälligst nicht immer alles von Geschlecht abmachen soll.', '', 'Ich bin gegangen,weil ich so dermaßen enttäuscht war und mich wieder mal überhaupt nicht verstanden fühlte.', '', 'Daran dass ich gegangen bin, war tatsächlich eine Frau Schuld, die eigentlich ein bisschen mehr Verständnis hätte haben sollen.', '', 'Fazit: Nicht alle Männer sind schlecht. Manche Frauen aber durchaus.']","['', '', 'Gesamtzufriedenheit:', 'zufrieden', '', 'Qualität der Beratung:', 'zufrieden', '', 'Mediz. Behandlung:', 'zufrieden', '', 'Verwaltung und Abläufe:', 'zufrieden', '', 'Ausstattung und Gestaltung:', 'zufrieden', '', '', '']"
Asklepios Fachklinikum Tiefenbrunn,Psychosomatik,10.12.2020,Kompetente Behandlung und reibungslose Kommunikation,"['Ich habe als niedergelasssene Psychotherapeutin in diesem Jahr 2 PatientInnen in die Psychosomatische Abteilung der Klinik vermittelt.', 'Schnelle Kontaktaufnahme nach Eingang der Anmeldeunterlagen durch das Aufnahmesekretariat bzw. dem Chefarzt der Abteilung zur Klärung individueller Voraussetzungen und Bedürfnisse der PatientInnen. ', 'Aufnahmetermine erfolgten rasch innerhalb von 3-4 Wochen, über diese wurde auch ich jedesmal parallel informiert. ', '', 'Beide PatientInnen setzten danach ihre ambulante Psychotherapie bei mir fort. Sie haben jeweils deutlich von der stationären Behandlung profitiert.', 'Ein/e PatientIn konnte dabei besonders die Einbettung in die Patientengruppe im Stationsalltag und die dort stattfindenden Auseinandersetzungen sowie die Klärungsmöglichkeiten,  Herausforderungen und Rückmeldungen innerhalb der psychoanalytisch-interaktionenellen Gruppentherapie und der Körpertherapie nutzen.', 'Besonders erwähnenswert war die kompetente Begleitung, das Zutrauen und das Stellen von bewältigbaren Herausforderungen und Unterstützung bei einem/r sehr gehemmten PatientIn durch das Pflegepersonal und die behandelnde Therapeutin.']","['', '', 'Gesamtzufriedenheit:', 'sehr zufrieden', '', 'Qualität der Beratung:', 'sehr zufrieden', '', 'Mediz. Behandlung:', 'sehr zufrieden', '', 'Verwaltung und Abläufe:', 'sehr zufrieden', '', 'Ausstattung und Gestaltung:', 'sehr zufrieden', '', '', '']"
