Name,Department,Date,Title,Review,Rating
KRH Klinikum Lehrte,Diabetes,20.06.2017,Perfekt,['Ich bin begeistert. Ich wurde hervorragend von der Stationsleitung und dem Oberarzt betreut. Ich bin super eingestellt worden. In meiner jetzigen ambulanten Diabethologi Vorzeigepatientin. Nur zu empfehlen'],"['', '', 'Gesamtzufriedenheit:', 'zufrieden', '', 'Qualität der Beratung:', 'sehr zufrieden (Die Schwestern sind überfordert)', '', 'Mediz. Behandlung:', 'sehr zufrieden', '', 'Verwaltung und Abläufe:', 'zufrieden', '', 'Ausstattung und Gestaltung:', 'zufrieden', '', '', '']"
KRH Klinikum Lehrte,Gastrologie,20.02.2017,es wurde sehr zügig behandelt,"['Wir sind sehr nett und freundlich in der Notaufnahme empfangen worden. Meine Tochter wurde sofort behandelt und alles ging relativ zügig voran. Vielen Dank dafür! ', '', 'Natürlich kommt es auch darauf an, wie viele Patienten gerade in der Notaufnahme behandelt werden und wie akut  das Krankheitsbild der jeweiligen Patienten ist. Bei uns war es relativ leer. Trotzdem muss man auch mal eon positives Feedback geben als immer nur zu meckern!!!']","['', '', 'Gesamtzufriedenheit:', 'zufrieden', '', 'Qualität der Beratung:', 'sehr zufrieden', '', 'Mediz. Behandlung:', 'sehr zufrieden', '', 'Verwaltung und Abläufe:', 'sehr zufrieden', '', 'Ausstattung und Gestaltung:', 'zufrieden', '', '', '']"
KRH Klinikum Lehrte,Chirurgie,15.02.2017,"Krankenhaus Lehrte, Station 5 gerne wieder für Chirurgische Aufenthalte","['Die Gesundheits- und Krankenpflegerinnen und Pfleger sind qualifiziert & wirklich kompetent. Das gesamte Personal (mit den Üblichen Ausnahmen) ist sehr freundlich. Man fühlt sich auch von den Ärzten ernstgenommen. Leider sieht man diese wie überall höchstens 5 Minuten am Tag. ', '', 'Operation ist gut verlaufen und das Aufklärungsgespräch war gut. Ich kann Lehrte empfehlen. Station 5 ganz besonders.']","['', '', 'Gesamtzufriedenheit:', 'zufrieden', '', 'Qualität der Beratung:', 'sehr zufrieden', '', 'Mediz. Behandlung:', 'sehr zufrieden', '', 'Verwaltung und Abläufe:', 'weniger zufrieden (Bürokratischer Aufwand hoch)', '', 'Ausstattung und Gestaltung:', 'zufrieden', '', '', '']"
KRH Klinikum Lehrte,Thoraxchirurgie + Herz,05.01.2017,Patienten nicht ernst genommen und dann vergessen,"['Ich war vom 27.12.16 bis 02.01.17 im Krankenhaus Lehrte ! Über die Notaufnahme mit Einweisung ! Da ich schlimme Gallenkoliken über mehrere Tage hatte ! Der Oberarzt nahm mich und meine Schmerzen nicht wirklich ernst ! Hätte ich die Möglichkeit gehabt, wäre ich aufgrund der Diagnose meines einweisenden Arztes ( Gallenkolik mit Entzündung der Gallenblase, inkl. Gallenstein) in ein anderes Krankenhaus gefahren. ', 'Aber irgendwie ging es nach 4 Stunden endlich auf Station . Dort bekam ich einen tropf mit Antibiotika und Schmerzmittel angelegt ! ', 'Am nächsten Morgen kam ein Pfleger der mich in den OP bringen wollte . ', 'Toll den ich war nicht vorbereitet ! Dann ging er wieder! Eine Schwester kam und ich bekam eine Tablette , sowie OP Hemd! Sofort  kam ich in den OP ! ', 'Dieser Tag war mies, den im Aufwachraum fiel mein Blutdruck,so das ich lange dort war ,so das ich erst gegen 18.00 real auf einem Zimmer einer anderen Station gelandet war ! Mega Schmerzen ! Dr. Erklärte mir irgendwas ! Und ich bekam wieder etwas gegen Schmerzen ! Mein Bauch wieder dick und dicker ! ', 'Am nächsten Tag kam Visite , laut denen soweit alles gut ! Ein Arzt kam dann mehrfach ,sich meinen Bauch ansehen ! Dann UPS !!!! Sono , Arzt , noch ein Arzt , Blutwerte Scheiße, hallooo ! ', 'Dann wieder ein Arzt der mich darüber aufklärte, das ich Blutungen im Bauchraum hätte und nochmal in den OP Muß ,! Ich fühlte mich mieser den je !  OP ließ nicht lange auf sich warten ( Not OP , wurde gesagt! Angehörige informieren ! Gerade so eben ! ', 'Hb Abfall unter 7 ! Spülen des Bauchraumes, erfolgreich !', 'Nach all dem Mist, kam ich ein wenig auf die Beine !', 'Am 2.1. sollte ich erst verlegt werden , ABER ! Nein , nochmal Blutwerte ermitteln, dann nochmal Sono ! ', 'Dann hab ich bis 17.00 gewartet! Nix ! Obwohl ich mehrmals nachgefragt habe ,! Keine Blutwerte,kein Brief !        ', 'Ok. Ich ließ mich nicht abwimmeln, und würde mega böse !', 'Dann hieß es , ich sei nicht mehr im System! ', 'UPS ! ', 'Dann kam eine nette Schwester, die mir sagte ,das ich den Bericht in der Notaufnahme abholen und dann nach Hause fahren kann ! ', 'Wow,!! Was für ein WAHNSINN !']","['', '', 'Gesamtzufriedenheit:', 'unzufrieden', '', 'Qualität der Beratung:', 'unzufrieden', '', 'Mediz. Behandlung:', 'unzufrieden', '', 'Verwaltung und Abläufe:', 'weniger zufrieden', '', 'Ausstattung und Gestaltung:', 'zufrieden', '', '', '']"
KRH Klinikum Lehrte,Skorpio2,12.12.2016,Ein Haus zum Krank-Werden,"['Mit Bluthochdruckkrise in die Notaufnahme gekommen, wurde der Blutdruck rasch gesenkt. Dann blieb ich, an EKG und Tropf mit zunehmendem Blasendruck allein. Weil   meine Rufe nicht gehört wurden, rief ich nach 30 Min. mit dem Handy den Pförtner der Klinik an, der das Personal der Notaufnahme informierte. Über diese Problemlösung konnte ich noch lachen. Mir wurde geraten, zur Beobachtung die Nacht in der Klinik zu verbringen. Dann könnte auch mit Röntgenbild und Ultraschalluntersuchung organische Ursachen elimininiert werden. Aus einer Nacht wurden 2,5 Tage. Die Röntgenaufnahme wurde erst am Nachmittag erstellt und ein Kardiologe für die Ultraschalluntersuchung war nicht da. Bei der Untersuchung am nächsten Tag meinte der Arzt, dass ich entlassen werden könne, empfahl mir aber, weil meine Medikamente wegen Nebenwirkungen umgestellt werden müssten, noch bis zum nächsten Tag zu bleiben. Er werde die Station bezüglich meiner Entlassung unterrichten. Das Stationspersonal wusste am nächsten Tag nichts davon, sprach nun von einer 24-Stunden-Blutdruckmessung. Nach einigem Drängen war dann eine Schwester bereit, den Oberarzt anzurufen, der die Entlassung bestätigte. Die Pflegekräfte waren sehr bemüht, aber auch überlastet. Es fiel schwer, sie mit individuellem Anliegen anzusprechen. Dass sie auf Bedürfnisse dennoch eingingen, rechne ich hoch an. Meine Individualität sowie meine gesunde Lebensführung war aber nicht aufrecht zu erhalten. Dass Essen war ungeeignet, weil zuckerhaltig, mit tierischen Fetten belastet, kaum ballaststoffreich. Obst habe ich vermisst. Einer ausreichenden Bewegung stellten sich immer wieder Hindernisse in den Weg. Meine Versuche (Spaziergänge auf dem Flur etc.) wurden zu Störungen im Ablauf. Weiter entfernen konnte ich mich nicht, weil mir der Zeitpunkt von Untersuchungen nicht mitgeteilt werden konnte. Das Krankenhaus ist von seinen Abläufen und von seiner gelebten Haltung nicht auf den mündigen Patienten eingestellt. Er wird zum Objekt einer nicht erkennbaren Planung. Ich habe sogar Zweifel, das es eine konsequente Planung gibt. Untersuchungsergebnisse habe ich, bis auf die guten Informationen beim Sono nicht oder zufällig erfahren. Es war anstrengend und hat nicht zum Gesund-Werden beigetragen.']","['', '', 'Gesamtzufriedenheit:', 'unzufrieden (Auf dieses Krankenhaus würde ich wenn möglich verzichten)', '', 'Qualität der Beratung:', 'unzufrieden', '', 'Mediz. Behandlung:', 'weniger zufrieden (Die Notaufnahme hat gut gearbeitet. Der Rest ...)', '', 'Verwaltung und Abläufe:', 'unzufrieden (Die Kostenregelung war rasch geklärt :-))', '', 'Ausstattung und Gestaltung:', 'unzufrieden (Die Zimmer sind fürchterlich, schäbig)', '', '', '']"
KRH Klinikum Lehrte,Chirurgie,24.09.2016,Christine R. HÜFTTEP,"['Wegen Hüfttep lag ich vom 7.07. Bis 18.07.2016 auf Station 6 Chirurgie. Ich wurde ausführlich informiert bei Aufnahme und Behandlung. Ärzte,', 'Personal und Therapeuten waren freundlich und sehr bemüht.Auf meinen begründeten Wunsch hin wurde ein Blutzuckertest veranlasst. Am 1. Tag nach der Op konnte ich aufstehen und zu 98% alles selbst erledigen,trotz angebotener Hilfe. Am 3. Tag n. Op ', 'Machte ich erste positive Gehversuche, danach jeden', 'Tag 3-4mal, d.h. eigene und fleissige Mitarbeit ', 'und Krankengymnastik sind unverzichtbar! Konnte nach knapp 5 Wochen schon wieder autofahren und fast ohne Gehhilfen laufen.', 'Das Essen war mit Kräutern zu stark abgeschmeckt, wurde nach mehrmaliger Rücksprache mit Verwaltung abgestellt und war so gut zu essen.', 'Ich hatte ein Einzelzimmer. Die Reinigung war je nach Personalbesetzung meistens ok.', '', 'Ich würde mich, falls notwendig, jederzeit wieder auf Station 6 behandeln lassen und bedanke mich sehr für die gute Behandlung und Versorgung bei ÄRZTEN, PERSONAL und VERWALTUNG.']","['', '', 'Gesamtzufriedenheit:', 'sehr zufrieden', '', 'Qualität der Beratung:', 'sehr zufrieden', '', 'Mediz. Behandlung:', 'sehr zufrieden', '', 'Verwaltung und Abläufe:', 'sehr zufrieden', '', 'Ausstattung und Gestaltung:', 'sehr zufrieden', '', '', '']"
KRH Klinikum Lehrte,Chirurgie,09.08.2016,Jederzeit wieder!,"['Ich lag vom 3.8.- 8.8.wegen Knie Op auf Station 6 und ich muss sagen, jederzeit wieder.Alle Ärzte, Schwestern, Pfleger und Therapeuten überaus kompetent, immer freundlich,hilfsbereit und haben sich bei Fragen Zeit genommen, alles so gut wie möglich zu beantworten und zu erklären. ', 'Ich möchte nicht, aber wenn, würde ich jederzeit wieder dorthin gehen.']","['', '', 'Gesamtzufriedenheit:', 'sehr zufrieden', '', 'Qualität der Beratung:', 'sehr zufrieden', '', 'Mediz. Behandlung:', 'sehr zufrieden', '', 'Verwaltung und Abläufe:', 'sehr zufrieden', '', 'Ausstattung und Gestaltung:', 'zufrieden', '', '', '']"
KRH Klinikum Lehrte,IchBins2016,24.07.2016,Kein nächstes Mal!,"['Mit Bauchkrämpfen in der Nacht angekommen. Direkt Blutabnahme gelaufen und Schmerzmittel erhalten. Arzt hört mein Bauch ab, Abtastung nicht erfolgt. Warten auf Blutwerte dauert 1 1/2 Stunden. Sehstörungen bekommen. Konnte nichts mehr lesen und nichts mehr scharf stellen. Sei eine Nebenwirkung vom Medikament. Arzt sagt Laborwerte normal. Macht schnell einen Ultraschall. Alles unauffällig. Bekomme Arztbrief und darf gehen. ', '', 'Keiner fragt nach Besserung der Sehstörungen. Schmerzen nach Schmerzmittelgabe gebessert aber noch vorhanden.', '', 'Laborwerte - Entzündungsmarker CRP erhöht. ', '', 'Arztbrief zum Teil gelogen.', '', 'Eine weitere Patienten steht am Empfang der Notaufnahme 10 min. mit starken Schmerzen. Pflegekräfte samt Ärzte draußen am Rauchen.', '', 'Ältere Patienten neben mir mit akuter Herzrhythmusstörung und Luftnot. Nicht am Monitor angeschlossen. Keine Klingel erhalten.']","['', '', 'Gesamtzufriedenheit:', 'unzufrieden', '', 'Qualität der Beratung:', 'weniger zufrieden', '', 'Mediz. Behandlung:', 'unzufrieden', '', 'Verwaltung und Abläufe:', 'weniger zufrieden', '', 'Ausstattung und Gestaltung:', 'weniger zufrieden', '', '', '']"
KRH Klinikum Lehrte,Puelpi,13.05.2016,Nie wieder Notaufnahme Lehrte,"['Mein Mann ist als Notfall eingewiesen worden. Ich berichte also von der Notaufnahme.  Nachdem mein Mann zunächst mit Morphium vollgrpumpt wurde, sollte er nach seinem Unfall zum Röntgen laufen. Erst nach meinem Einschreiten wurde er gefahren. Den gebrochenen Rücken hat der NotArzt nicht erkannt, hat sich geweigert uns die Bilder zu zeigen. Dann sollte mein Mann nach Hause entlassen werden und brach zusammen. Nachdem er das ganze Wochenende weiterhin Morphium bekam sollte er damit Montag erneut entlassen werden. Gott sei Dank trat dann mal ein fähiger Arzt auf, der schon auf den  Röntgenaufnahmen den Verdacht der Fraktur hatte und diese durch ein CT bestätigen ließ. Da der selbe Arzt der Notaufnahme bei mir bereits eine Unterarm Fraktur unversehrt hat und einen Kreuzbeinbruch übersah , schreibe ich nun diese Kritik. Da der Chirurg auf Station fähig scheint , fällt nur die Notaufnahme durch!!!']","['', '', 'Gesamtzufriedenheit:', 'unzufrieden', '', 'Qualität der Beratung:', 'unzufrieden', '', 'Mediz. Behandlung:', 'weniger zufrieden', '', 'Verwaltung und Abläufe:', 'zufrieden', '', 'Ausstattung und Gestaltung:', 'zufrieden', '', '', '']"
KRH Klinikum Lehrte,Chirurgie,22.02.2016,Operation Station 6,"['Habe am 21.01.2016 ein neues Knie bekommen super aerzteteam, nette Schwestern gute Betreuung Zimmer okay essen war nicht so meins würde immer wieder in das Krankenhaus gehen und kann die Chirurgie nur weiterempfehlen']","['', '', 'Gesamtzufriedenheit:', 'sehr zufrieden', '', 'Qualität der Beratung:', 'sehr zufrieden', '', 'Mediz. Behandlung:', 'sehr zufrieden', '', 'Verwaltung und Abläufe:', 'sehr zufrieden', '', 'Ausstattung und Gestaltung:', 'zufrieden', '', '', '']"
KRH Klinikum Lehrte,Chirurgie,01.02.2016,Zimmer eine Zumutung!,"['Meine Mutter, 77 Jahre wurde am 26.01.16 Stationär angemeldet aufgenommen. Gegen 89 € pro Tag extra ein Einzelzimmer belegt.', 'Das Verwaltungstechnische lief unkompliziert und recht zügig ab, auch die Aufnahme auf Station 6', 'Im Zimmer angekommen waren wir sprachlos: Das Zimmer wurde seit Jahrzehnten nicht Renoviert und Instandgehalten, der an der Wand befestigte Fernseher hat bei Sammlern bestimmt schon einen Wert, lockere Kabel baumelten herunter. Der Boden ist total abgenutzt und voller schwarzen Schlieren. Am schlimmsten sind jedoch die Hygienischen Mängel: An den Schränken Schnodderstreifen, der Boden im Nachtischbereich voll alter Kaffeeflcken und Staubflusen, im Bad lag der Toilettenaufsatz auf dem Kachelboden; welcher sich auch nicht fest auf dem WC anbringen ließ!', 'Die Putzerei beginnt morgens um 6:30 und dauert 2-3 Minuten !!!', 'Das Essen ist eine Zumutung, auch nach dem 3.Tag bekam meine Mutter keine Diabetiker Kost!', 'Auch befindet sich keine Dusche im Zimmer ...', 'Fazit: Für frisch operierte Patienten allergrößte Gefahr sich mit bösen Keimen zu infizieren!!!']","['', '', 'Gesamtzufriedenheit:', 'unzufrieden', '', 'Qualität der Beratung:', 'zufrieden', '', 'Mediz. Behandlung:', 'sehr zufrieden', '', 'Verwaltung und Abläufe:', 'zufrieden', '', 'Ausstattung und Gestaltung:', 'unzufrieden', '', '', '']"
KRH Klinikum Lehrte,Chirurgie,17.09.2015,"mangelnde Hygene, verschmutztes Zimmer","['Vor kurzem wurde bei mir eine Schulterarthroskopie vorgenommen und das Schultergelenk operiert.', 'Aufnahme und Ablauf waren soweit zufriedenstellend.', 'Das Zweibettzimmer in dem ich untergebracht war, ließ zu Wünschen übrig. Es mangelte an ausreichender Hygiene. Das Zimmer war sehr verschmutzt, vor allem der Fußboden. Die Reinigungsfrau brauchte nicht mal eine Minute um Bad und Zimmer zu reinigen. Alles wurde sehr oberflächlich gewischt. Toilettenbecken und Waschbecken wurden überhaupt nicht gereinigt.', 'so ein Krankenhaus in so einem verunreinigten Zustand! Von Hygiene und Desinfektion keine Spur.', 'Man hört ja immer wieder in den Medien dass Patienten in Krankenhäusern mit Keimen infizieren, weil hier nicht ausreichend gereinigt und desinfiziert wird.', 'Ich hatte ein sehr schlechtes Gefühl und überlege ob ich noch mal dieses Krankenhaus aufsuchen würde. Nicht empfehlenswert!!']","['', '', 'Gesamtzufriedenheit:', 'unzufrieden (Hygiene, Sauberkeit, Zustand allgemein)', '', 'Qualität der Beratung:', 'zufrieden (medizinische Versorgung und Begleitung i. O.)', '', 'Mediz. Behandlung:', 'sehr zufrieden', '', 'Verwaltung und Abläufe:', 'zufrieden', '', 'Ausstattung und Gestaltung:', 'unzufrieden', '', '', '']"
KRH Klinikum Lehrte,Verstoß melden,02.08.2015,Lehrter Klinikum soll bleiben,"['Bin schon oft in Klinikum Lehrte sehr gut behandelt worden. Werde immer wieder mich von hiesigen Ärzten behandeln lassen. Meinen grosser Dank geht an die Leitende Oberärztin  Frau Dr. I. Mander sowie Frau Dr.Droßel und allen anderen Ärzten und dem gesamten Pflegepersonal.', 'Die medizinische Versorgung in Lehrter Klinikum ist von bester Qualität !', 'Allerdings könnte der Kaffe besser sein und manches Essen vom Speiseplan ', 'verschwinden!', 'Hoffentlich bleibt uns dieses tolle Krankenhaus erhalten!']","['', '', 'Gesamtzufriedenheit:', 'sehr zufrieden', '', 'Qualität der Beratung:', 'sehr zufrieden', '', 'Mediz. Behandlung:', 'sehr zufrieden', '', 'Verwaltung und Abläufe:', 'weniger zufrieden (Die Aufnahme dauert zu lange)', '', 'Ausstattung und Gestaltung:', 'zufrieden', '', '', '']"
KRH Klinikum Lehrte,anlo007,14.08.2014,unglaubliche Zustände/top Arroganz,['Diese Bewertung geht nicht in die Gesamtbewertung ein'],"['', '', 'Gesamtzufriedenheit:', 'unzufrieden', '', 'Qualität der Beratung:', 'unzufrieden', '', 'Mediz. Behandlung:', 'zufrieden (gilt nur für die Notaufnahme)', '', 'Verwaltung und Abläufe:', 'unzufrieden', '', '', '']"
KRH Klinikum Lehrte,Chirurgie,06.07.2014,POSITIV,['Diese Bewertung geht nicht in die Gesamtbewertung ein'],"['', '', 'Gesamtzufriedenheit:', 'zufrieden', '', 'Qualität der Beratung:', 'sehr zufrieden', '', 'Mediz. Behandlung:', 'sehr zufrieden', '', 'Verwaltung und Abläufe:', 'zufrieden', '', '', '']"
KRH Klinikum Lehrte,Emsa,02.09.2013,Unfreundlich und inkompetent,['Diese Bewertung geht nicht in die Gesamtbewertung ein'],"['', '', 'Gesamtzufriedenheit:', 'unzufrieden', '', 'Qualität der Beratung:', 'unzufrieden', '', 'Mediz. Behandlung:', 'unzufrieden (vor allem die Kompetenz im Umgang mit einem alten, multimobiden Patienten ist grottenschlecht)', '', 'Verwaltung und Abläufe:', 'weniger zufrieden', '', '', '']"
KRH Klinikum Lehrte,Chirurgie,04.03.2013,"KLasse Aeerzte und Personal, schlechte Ausstattung des Zimmers",['Diese Bewertung geht nicht in die Gesamtbewertung ein'],"['', '', 'Gesamtzufriedenheit:', 'zufrieden', '', 'Qualität der Beratung:', 'sehr zufrieden', '', 'Mediz. Behandlung:', 'sehr zufrieden', '', 'Verwaltung und Abläufe:', 'weniger zufrieden', '', '', '']"
KRH Klinikum Lehrte,Chirurgie,14.09.2012,Unkompetens Krankenhaus,['Diese Bewertung geht nicht in die Gesamtbewertung ein'],"['', '', 'Gesamtzufriedenheit:', 'unzufrieden (entnehmen Sie das meinen Bericht)', '', 'Qualität der Beratung:', 'unzufrieden', '', 'Mediz. Behandlung:', 'unzufrieden', '', 'Verwaltung und Abläufe:', 'unzufrieden', '', '', '']"
Krankenhaus Lindenbrunn,Chirurgie,09.03.2021,Sehr kompetentes Fachpersonal und sehr gute Betreuung,"['Meine 92jährige Mutter war zur Reha auf der Station 1 im Lindenbrunn, weil sie sich einen Oberschenkelhalsbruch zugezogen hatte. Die fachärztliche Betreuung war sehr gut, das Personal sehr unterstützend und aufbauend und meine Mutter konnte nach einem dreiwöchigen Aufenthalt nach Hause entlassen werden. Sie kann wieder selbstbestimmt in ihrer häuslichen Umgebung leben.  ', '', 'Während ihres Aufenthaltes durfte ich sie nach vorherigem Coronatest besuchen.', '', 'Insgesamt geben wir eine sehr !!! positive Beurteilung über diese Klinik ab und können sie definitiv weiterempfehlen.']","['', '', 'Gesamtzufriedenheit:', 'sehr zufrieden', '', 'Qualität der Beratung:', 'sehr zufrieden', '', 'Mediz. Behandlung:', 'sehr zufrieden', '', 'Verwaltung und Abläufe:', 'sehr zufrieden', '', 'Ausstattung und Gestaltung:', 'sehr zufrieden', '', '', '']"
Krankenhaus Lindenbrunn,Neurologie,10.02.2021,Durch aus zufrieden,"['Also,Ich habe durchweg positive Erfahrung. Ich war zum zweiten Mal hier und bin durch aus zufrieden. Meine Tabletten Einstellung wurden angepasst.']","['', '', 'Gesamtzufriedenheit:', 'sehr zufrieden', '', 'Qualität der Beratung:', 'sehr zufrieden', '', 'Mediz. Behandlung:', 'sehr zufrieden', '', 'Verwaltung und Abläufe:', 'sehr zufrieden', '', 'Ausstattung und Gestaltung:', 'zufrieden', '', '', '']"
Krankenhaus Lindenbrunn,Verstoß melden,12.01.2021,Erstmal Urlaub machen,[' '],"['', '', 'Gesamtzufriedenheit:', 'unzufrieden (Einen kranken Menschen, Nicht mal zugedeckt.)', '', 'Qualität der Beratung:', 'unzufrieden (Unpersönlich, kein Interesse am Verlauf)', '', 'Mediz. Behandlung:', 'unzufrieden (Kein Therapieprogramm über Feiertage)', '', 'Verwaltung und Abläufe:', 'unzufrieden (Da alle anderen Punkte nicht befriedigend)', '', 'Ausstattung und Gestaltung:', 'unzufrieden (Nicht fürsorglich. Sollte aber in einer solchen Einrichtung unbedingt vorhanden sein)', '', '', '']"
Krankenhaus Lindenbrunn,Geriatrie,03.01.2021,.,"['Seit wann funktioniert ein Verein zur Betreuung von Schwerbehinderten als Krankenhaus ? Und wo ? In Coppenbrüge haha.Die Oberärztin ist sehr genial,beim Formulierung von Echobefund (Befund von 2 Zeilen)öffnet sie die Bücher sonst kann sie kein Befund auswendig formulieren und das nach 20 Jahren Erfahrung. Steht aber bereit die Ausbildung von Ass.Ärzten zu schaden.Wer erlaubt diese Menschen überhaupt auf diesem Gebiet zu funktionieren']","['', '', 'Gesamtzufriedenheit:', 'unzufrieden', '', 'Qualität der Beratung:', 'unzufrieden', '', 'Mediz. Behandlung:', 'unzufrieden', '', 'Verwaltung und Abläufe:', 'unzufrieden', '', 'Ausstattung und Gestaltung:', 'unzufrieden', '', '', '']"
Krankenhaus Lindenbrunn,Neurologie,27.07.2020,Ich kann von einem Klinikaufenthalt nur abraten,"['Unserer Erfahrung nach fand keine eingehende professionelle medizinische Anamnese statt. Ebenso mussten Informationen über den aktuellen Zustand, Behandlungs- und Therapieansätze von den in diesem Fall sogar bevollmächtigten Angehörigen stets erkämpft werden. Ein Zutritt wurde bereits vor dem von Ihrem Ministerium ausgehenden Besuchsverbot verwehrt, ebenso ärztliche Gespräche vor Ort. Es wurde erst nach dem Aufenthalt unseres Vaters ein Hygienekonzept entwickelt, welches den Zugang von Besuchern regelt. Das heißt wir konnten unseren Vater und das behandelnde Personal über Wochen nicht treffen, obwohl sich unser Vater in einem dementiellen Zustand befunden hat.', 'Es kam zu einer Hospitalisierung und Traumatisierung aufgrund von wochenlanger Fixierung ohne uns als Angehörige zu Alternativen zu beraten. Ebenso wurde eine PEG gesetzt, zwar mit unserer Zustimmung aus der Entfernung, aber ohne das Ausloten anderer Möglichkeiten.', 'Wir hatten keine Informationen über die Qualifikation der behandelnden Ärzte. Diese Informationen finden sich auf keiner Stelle der Homepage des Krankenhauses.', 'Einzig eine der Oberärztinnen stand in Telefonaten für ausführlichere Informationen zu Verfügung, wenn sie in der Klinik war.', 'Auch die Maßnahmen in der Pflege muss ich in Frage stellen: Spitzfüße nach dem Aufenthalt trotz angeblicher guter Lagerung und Mobilisierung, unbegründete Umstellung der Ernährung auf passierte Koste, drei Wochen ohne Haare waschen in der Körperpflege, verspätete Information über fehlende Wäsche, …', 'Mein Vater wurde dort Mitte März eingeliefert und ist dort leider bis Mitte Mai 2020 verblieben. Am 08.07.2020 ist er verstorben.', 'Mein Vater war 72 Jahre alt. Er hat zuvor weitgehend selbstständig gelebt und sich selbst versorgt. Ja, er war gestürzt. Aber die Verschlechterung seines Gesundheitszustandes während des Klinikaufenthaltes in Coppenbrügge halte ich doch für sehr bedenklich.']","['', '', 'Gesamtzufriedenheit:', 'unzufrieden', '', 'Qualität der Beratung:', 'unzufrieden', '', 'Mediz. Behandlung:', 'unzufrieden', '', 'Verwaltung und Abläufe:', 'weniger zufrieden', '', 'Ausstattung und Gestaltung:', 'weniger zufrieden (Kann ich eigentlich nicht beurteilen)', '', '', '']"
Krankenhaus Lindenbrunn,Neurologie,26.03.2020,Empfehlenswerte Klinik mit kompetentem und sehr freundlichem Personal,"['Ich war 9 Tage im Krankenhaus Lindenbrunn auf Station 5. Trotz Besuchs- und Ausgehverbot aufgrund der Coronakrise war es ein angenehmer Aufenthalt. Von allen Krankenhäusern, die ich aus eigener Erfahrung kenne, habe ich mich in diesem Krankenhaus am wohlsten gefühlt.', 'Das Personal war durchgängig äußerst freundlich, hilfsbereits und sehr engagiert sowie stets gut gelaunt. Ein herzliches Dankeschön nochmals an das Pflegepersonal für die tolle Arbeit und auch an die Ärztinnen für die fachlich kompetente Behandlung.']","['', '', 'Gesamtzufriedenheit:', 'sehr zufrieden', '', 'Qualität der Beratung:', 'sehr zufrieden', '', 'Mediz. Behandlung:', 'sehr zufrieden', '', 'Verwaltung und Abläufe:', 'sehr zufrieden', '', 'Ausstattung und Gestaltung:', 'sehr zufrieden', '', '', '']"
Krankenhaus Lindenbrunn,Neurologie,10.03.2020,Stephen Kings Carrie,['Die Therapeuten sind spitze in jeglicher Hinsicht sie geben sich richtig viel Mühe zeigen Einfühlungsvermögen und nehmen sich auch Zeit. Auch wenn persönliche Probleme zu dem Krankheitsbild dazukommen haben sie trotzdem ein offenes Ohr.'],"['', '', 'Gesamtzufriedenheit:', 'zufrieden', '', 'Qualität der Beratung:', 'sehr zufrieden', '', 'Mediz. Behandlung:', 'sehr zufrieden', '', 'Verwaltung und Abläufe:', 'zufrieden', '', 'Ausstattung und Gestaltung:', 'zufrieden', '', '', '']"
