Name,Department,Date,Title,Review,Rating
DIAKOVERE Annastift,Orthopädie,19.10.2019,Einfach TOP,"['Nach einem MRT und dem Verdacht auf einen Meniskusschaden mit der zusätzlichen Feststellung von zwei Raumforderungen im rechten Knie wurde mir von meinem Hausarzt die Klink im Annastift empfohlen.', '', 'Schon ab der ersten ambulanten Sprechstunde fühlte ich mich hier sehr gut aufgehoben.', '', 'Im weiteren Verlauf (Anmeldung und Aufnahme auf der Station) setzte sich dieser Eindruck weiter fort.', '', 'Die Ärzte und das Pflegepersonal waren sehr um uns Patienten bemüht und hatten immer Zeit bei weiteren Fragen oder Anmerkungen.', '', 'Zur OP und Nachsorge wurde uns immer wieder gesagt, sollten Schmerzen auftreten oder schlimmer werden, sollten wir uns sofort melden, um die Medikation anzupassen.', '', 'Die OP verlief sehr gut, es traten nach der OP keine Schmerzen auf die Tumore wurden entfernt und ich wurde nach sechs Tagen entlassen.', '', 'Ich kann hier und heute diese Klinik nur empfehlen, ich fühlte mich hier, wie oben schon beschrieben, sehr gut aufgehoben.']","['', '', 'Gesamtzufriedenheit:', 'sehr zufrieden (Danke an das gesamte Team der Station A4)', '', 'Qualität der Beratung:', 'sehr zufrieden', '', 'Mediz. Behandlung:', 'sehr zufrieden', '', 'Verwaltung und Abläufe:', 'sehr zufrieden', '', 'Ausstattung und Gestaltung:', 'zufrieden', '', '', '']"
DIAKOVERE Annastift,Orthopädie,01.10.2019,Angenehmer Aufenthalt,"['Ich musste bereits das vierte Mal am Fuß operiert werden und habe alle vier Operationen im Annastift durchführen lassen.', 'Ich habe mich immer gut aufgehoben gefühlt.', 'Die Ärzte machen auf mich einen kompetenten Eindruck und das gesamte Personal ist hilfsbereit und freundlich.', '', 'Bei meiner jetzigen OP lag ich auf der umgebauten/renovierten Station. Kein Vergleich zu der unrenovierten Station.', 'Jetzt befinden sich sowohl WC als auch Dusche auf dem Zimmer. Mein Zimmer war ein Zweibettzimmer und jedes Bett hat seinen eigenen Fernseher. Das Bett war voll elektrisch verstellbar. Für ein Krankenhaus ein wirklich schönes Zimmer, dieses konnte den Aufenthalt angenehmer machen.', '', 'Das Essen ist im Ordnung. Das Mittagessen fande ich zum Teil auch wirklich ganz lecker.']","['', '', 'Gesamtzufriedenheit:', 'sehr zufrieden', '', 'Qualität der Beratung:', 'sehr zufrieden', '', 'Mediz. Behandlung:', 'sehr zufrieden', '', 'Verwaltung und Abläufe:', 'zufrieden (Lange Wartezeit bei Aufnahmegespräch)', '', 'Ausstattung und Gestaltung:', 'sehr zufrieden', '', '', '']"
DIAKOVERE Annastift,Chirurgie,06.09.2019,das beste krankenhaus was ich bis jetzt besucht habe.,"['Die sind dabei das komplette krankenhaus zu sanieren und damit haben teilweise komplette etagen ausser betrieb genommen - meine station fand sich auf ein neuliche renovierten etage :-). in meinem raum war platz für nur 2 betten also ruhe ist (fast) garantiert. Es gab kostenloses wasser (wie immer) aber auch kostenloses WLAN und fernseher (1 interaktives fehrnseher pro bett!) mit kopfhörer. die betten waren auch komplett elektrisch zu bedienen also keine schwierigkeiten irgenetwas zu ändern in position, auch kein gründ eine Schwester um hilfe zu bitten dein kissen ein bisschien höher zu stellen oder so.... Die mitarbeitern (Physiotherapeuten, schwestern, aushilfen , ärtzte oder orderlies waren ALLE sehr nett und hilfreich. Wenn ich zum andere abteilung gehen soll um zB. einem röntgen zu machen dann gab es fast kein wartezeiten (maximal 5 minuten müsste ich einmal warten) was echt erstaunlich ist in den meisten krankenhaüser wo ich bisjetzt war. Normalerwise müsste ich mindestens 20 minuten warten (MHH). Sauber war der klinik in jeder patienten station wo ich durchgegangen bin und auch auf die gäste toiletten. ich hab immer die putz kolonie am akkern sehen um eine gute standart zuhalten.']","['', '', 'Gesamtzufriedenheit:', 'sehr zufrieden (Danke an alle :-))', '', 'Qualität der Beratung:', 'sehr zufrieden', '', 'Mediz. Behandlung:', 'sehr zufrieden (Viel schneller geheilt als erwartet)', '', 'Verwaltung und Abläufe:', 'zufrieden (ist halt Deutschland - erwartet man es anders mit dem Büro krams?)', '', 'Ausstattung und Gestaltung:', 'sehr zufrieden (1 TV pro bett !!!! Internet !!! 2 Betten pro raum !!!!)', '', '', '']"
DIAKOVERE Annastift,Orthopädie,04.09.2019,Zwei Knie für ein Hallejuja,"['Jahrelang hatte ich Knieschmerzen, am linken Bein, durch einen Sportunfall.', 'Ich habe das linke Bein geschont und dadurch das rechte Bein überbelastet.', 'Dadurch erhielt ich im laufe der Zeit starke O Beine und stark schmerzende Knie.', 'In der Zeitung wurde ich auf das Annastift aufmerksam und besuchte einen Vortrag vom Professor Dr. Windheim.', 'Bei einer Voruntersuchung kamen wir zum Ergebnis ""beide', 'Knie"" gleichzeitig zu operieren und zwei Vollendophrothesen einzusetzen.', 'Da ich starke O Beine hatte wurden gekoppelte Knieprothesen eingebaut.', 'Die Vorbesprechungen liefen sehr Freundlich und gut verständlich ab', 'Die Op. gelang hervorragend und zu meiner vollsten Zufriedenheit( Vielen Dank an Herrn Dr.Ettinger und Team).', 'Ich konnte vom ersten Tag beide Knie voll belasten, hatte keine Schmerzen und war der Exot im Krankenhaus und in der Reha.', 'Wer hatte schon gleichzeitig zwei neue Knie ?', 'Heute nach ca 5 Wochen kann ich gut gehen und stehen, habe keine Schmerzen und bin voll zufrieden.', 'Die Ärzte und das OP Personal war sehr professionell', 'und sehr angenehm.', 'Der Nachtschwester möchte ich besonders danken, da Sie sich rührend um mich gekümmert hatte, mir die Angst nahm und mich gut auf die OP vorbereitet hatte. Ich aber nicht mal Ihren Namen weiß.', 'Die anderen Mitarbeiter der Klinik waren alle sehr nett und kompetent.', '', 'Ich kann das Annastift nur weiter empfehlen']","['', '', 'Gesamtzufriedenheit:', 'sehr zufrieden', '', 'Qualität der Beratung:', 'sehr zufrieden', '', 'Mediz. Behandlung:', 'sehr zufrieden', '', 'Verwaltung und Abläufe:', 'sehr zufrieden', '', 'Ausstattung und Gestaltung:', 'sehr zufrieden', '', '', '']"
DIAKOVERE Annastift,Verstoß melden,04.08.2019,Orthopädie,['Super Klinik für Kinderorthopädie! Nette Ärzte und Schwestern. Kompetente Beratung! Guter OP Verlauf. Das einzigste negative keine WC und Dusche im Zimmer. Nur Vorhänge am Waschbecken. Essen so ok. Betreuung super spitzen Klasse. Leider einige dreckige Ecken auf Station. Rollstuhl war dreckig. Das könnte verbessert werden. Treppenhaus und Flure sehr dreckige Ecken! Wände in den WC Anlagen waren dreckig!'],"['', '', 'Gesamtzufriedenheit:', 'sehr zufrieden', '', 'Qualität der Beratung:', 'sehr zufrieden', '', 'Mediz. Behandlung:', 'sehr zufrieden', '', 'Verwaltung und Abläufe:', 'sehr zufrieden', '', 'Ausstattung und Gestaltung:', 'sehr zufrieden', '', '', '']"
DIAKOVERE Annastift,Orthopädie,05.03.2019,Sehr zufrieden!,"['Vom ersten bis zum letzte Tag sehr gute Betreuung durch das Personal. Schmerztherapie wird ernst genommen. Trotz hoher Belastung der Schwestern, immer und jeder freundlich. Gute Aufklärung der Ärzte postoperativ.', 'Die Zimmer und Station alles neu und schön ausgestattet.', 'Ich kann die Klinik nur empfehlen!!']","['', '', 'Gesamtzufriedenheit:', 'sehr zufrieden', '', 'Qualität der Beratung:', 'sehr zufrieden', '', 'Mediz. Behandlung:', 'sehr zufrieden', '', 'Verwaltung und Abläufe:', 'sehr zufrieden', '', 'Ausstattung und Gestaltung:', 'sehr zufrieden', '', '', '']"
DIAKOVERE Annastift,Orthopädie,29.01.2019,Besser geht nicht,"['Wirbelgleiten Spinalstenose Wirbelversteifung 3-4 und 4-5', 'Habe lange gesucht, war auch in Hamburg, letzte Entscheidung ANNASTIFT Hannover.', 'Da hat alles gepasst.', 'Krankenhauskeime haben es hier schwer, am Tag der Aufnahme Abstrich Mund, Nase auf Station Leiste.', 'Tag darauf OP.', 'Vorbereitung, mit spezial Duschgel waschen, flüssigkeit zur Mundspülung.', 'Narkosearzt (kannte ich schon vom Vorgespräch) bevor man Schlafen geht erscheint nochmal mit einem lächeln.', 'Nach der OP: der Chirurg kommt ans Bett stellt sich vor und sagt das alles gut verlaufen ist.', 'Auf Station 1 Schwestern und Pfleger top.', 'Die beste Entscheidung die ich in meinem Leben je getroffen habe.', 'Vielen lieben Dank an Euch alle, Ihr seid Spitze.', '']","['', '', 'Gesamtzufriedenheit:', 'sehr zufrieden', '', 'Qualität der Beratung:', 'sehr zufrieden', '', 'Mediz. Behandlung:', 'sehr zufrieden', '', 'Verwaltung und Abläufe:', 'zufrieden', '', 'Ausstattung und Gestaltung:', 'sehr zufrieden', '', '', '']"
DIAKOVERE Annastift,Orthopädie,09.11.2018,erstklassige Klinik,"['Nach einer sehr guten und ausführlichen Beratung in der Sprechstunde, ca 3 Monate vor der Op, wurde ich am 01.10.2018 von Herrn PD Dr. med Ettinger und seinem Team, im Rahmen einer ""invasiven Studie"" (Computerbegleitende Op)am Knie operiert. Mit dem Ergebnis bin ich sehr zufrieden, war schmerzfrei und konnte schon am nächsten Tag Gehübungen unter Vollbelastung ausüben.', 'Fazit: Betreuung von der Aufnahme bis zur Entlassung in die REHA erstklassig.']","['', '', 'Gesamtzufriedenheit:', 'sehr zufrieden', '', 'Qualität der Beratung:', 'sehr zufrieden', '', 'Mediz. Behandlung:', 'sehr zufrieden (mein besonderer Dank gilt Herrn PD Dr. med Ettinger)', '', 'Verwaltung und Abläufe:', 'sehr zufrieden', '', 'Ausstattung und Gestaltung:', 'sehr zufrieden (ich hatte als Kassenpatient als Wahlleistung ein 2-Bett-Zimmer auf Station 8)', '', '', '']"
DIAKOVERE Annastift,Orthopädie,28.10.2018,Super Klinik,"['Ich war an 17.9.18 im Annastift habe eine neue Hüfte bekommen,bin absolut begeistert ,die Ärzte sowieso das Pflegepersonal top und auch die Physiotherapie alles supergut.Den Pflegepersonal wurde nichts zuviel immer super nett.Uch kann das Annastift nur weiter empfehlen.Die OP bis jetzt alles gut ich war vonm ersten Tag an schmerzfrei']","['', '', 'Gesamtzufriedenheit:', 'sehr zufrieden (Mehr geht nicht)', '', 'Qualität der Beratung:', 'sehr zufrieden', '', 'Mediz. Behandlung:', 'sehr zufrieden (Alles top)', '', 'Verwaltung und Abläufe:', 'sehr zufrieden (Es gibt nichts zu meckern)', '', 'Ausstattung und Gestaltung:', 'zufrieden', '', '', '']"
DIAKOVERE Annastift,Orthopädie,27.09.2018,Gluteusrefixation an der Hüfte,"['Nach einer Hüft-OP mit TEP in einer anderen Klinik in der Region Hannover hatte ich auch nach 2 Jahren noch Beschwerden beim Gehen. Im Laufe der beiden Jahre sprach ich bei mehreren Orthopäden, Kliniken und Spezialisten vor. Im Annastift besuchte ich die Endo-Sprechstunde und bekam endlich eine Diagnose, denn man hörte mir zu, sichtete meine Unterlagen und führte weitergehende Untersuchungen durch, die bis dato nicht gemacht worden sind. Aufgrund der Dinglichkeit und der andauernden Schmerzen erfolgte die stationäre Aufnahme mit OP-Termin innerhalb kurzer Zeit. ', '+ Ausführliche Aufklärung über die OP, ', '+ warmherzige Aufnahme durch die Mitarbeiter ', '+ Betreuung vor und nach OP ', '+ Versorgung insgesamt', '+ Berücksichtigung und Aufklärung über Risiken ', 'incl. Darstellung von Alternativen zur geplanten', 'OP (wurde dann auch so erfolgreich durchgeführt)']","['', '', 'Gesamtzufriedenheit:', 'sehr zufrieden', '', 'Qualität der Beratung:', 'sehr zufrieden', '', 'Mediz. Behandlung:', 'sehr zufrieden', '', 'Verwaltung und Abläufe:', 'sehr zufrieden', '', 'Ausstattung und Gestaltung:', 'zufrieden (Toiletten leider auf dem Flur)', '', '', '']"
DIAKOVERE Annastift,Orthopädie,01.08.2018,Vier OPs mit Spätfolgen für eine Bandscheiben-Vorwölbung,"['Ich hatte Ischias-Beschwerden, verursacht durch den Druck einer kleinen Vorwölbung der unteren Bandscheibe auf die S1-Nervenwurzel, - diagnostiziert durch einen Orthopäden und per MRT bestätigt.', 'Die Vorwölbung wurde in der ersten Operation (OP) am 22.08. eigenmächtig ignoriert, ohne mich zu informieren. Wegen einer vom mir zufällig bemerkten Fußlähmung, wurde am 25.8. nach einer MRT durch einen anderen Operateur die Vorwölbung und ein Bluterguss (Hämatom), der die Fußlähmung durch Kompression der L5-Nervenwurzel verursacht hatte, beseitigt. Am 28.8. bemerkte ich wiederum zufällig eine Lähmung des rechten Beins, was nach einer MRT abermals die Beseitigung eines Hämatoms an der L5-Nervenwurzel in einer OP am Fr 30.08. erforderte. Man legte bewusst keine Drainagen. Wegen vorab gegebener vieler Schmerzmittel habe ich von den wohl sehr schmerzhaften Hämatomen im Wirbelkanal Nichts spüren können (sollen?). Die Lähmungen hätten vom Pflegepersonal erkannt werden müssen und nicht so spät von mir selbst.', 'Wegen dieser Erfahrungen bekam ich auf meine Bitte zu einer qualitätsabsichernden Abschluss-MRT die ablehnende Antwort, dass jede weitere MRT Grund für eine erneute OP sein würde!', 'Ich habe deshalb einen Neurochirurgen um eine Zweitmeinung gebeten, der in einer vierten OP am 29.9. die Situation mit wenig Schmerzmitteln, Drainage und Tests auf Lähmungen am Bett und  fachgerecht bereinigte. ', 'Dauerhaft geblieben ist eine erhebliche Gehstörung durch Fußlähmungen, d.h. Taubheit an Wade und Fuß, Lähmung der Zehen und des Sprunggelenks, wodurch die Gleichgewichtssteuerung beim Gehen gestört ist und der Fuß nur mit der Außenkante aufgesetzt werden kann.', 'Da mir orthopädische Hilfsmittel unter der Nachwirkung starker Narkosen ohne Notwendigkeit eilfertig aufgedrängt wurden, habe ich den Verdacht auf eine finanzielle Umsatzbeteiligung am hausinternen Sanitätshaus.', 'Die Wirbelsäulen Chirurgie scheint vom guten Ruf Anderer Departments zu profitieren.']","['', '', 'Gesamtzufriedenheit:', 'unzufrieden (Wegen schlechter Erfahrung Zweitmeinung eingeholt)', '', 'Qualität der Beratung:', 'unzufrieden (Keine Visiten des Operateurs mit Auskunft über OP-Verlauf)', '', 'Mediz. Behandlung:', 'unzufrieden (Drei OPs für den kleinsten Wirbelsäulen-Eingriff)', '', 'Verwaltung und Abläufe:', 'weniger zufrieden (Lange Wartezeit auf OP-Termin und auf OP-Berichte)', '', 'Ausstattung und Gestaltung:', 'zufrieden (Ausstattung für Privatpatient war akzeptabel)', '', '', '']"
DIAKOVERE Annastift,Orthopädie,26.07.2018,Beste Klinik für Orthopädie,"['Nach 2 misslungenen VKB-OP‘s wurde hier endlich eine Diagnose gestellt. Man hat quasi in der 3OP das heile gemacht, was andere verbockt haben. Erfahrene Ärzte und Schwestern- ohne Ausnahme! ', 'Nach 3 Tagen Klinikaufenthalt endlich wieder ohne Schmerzen - nach 4 Jahren!']","['', '', 'Gesamtzufriedenheit:', 'sehr zufrieden', '', 'Qualität der Beratung:', 'sehr zufrieden', '', 'Mediz. Behandlung:', 'sehr zufrieden', '', 'Verwaltung und Abläufe:', 'zufrieden', '', 'Ausstattung und Gestaltung:', 'sehr zufrieden', '', '', '']"
DIAKOVERE Annastift,Chirurgie,11.04.2018,Kann man nur weiter empfehlen,[' '],"['', '', 'Gesamtzufriedenheit:', 'sehr zufrieden (Würde ich jederzeit weiter empfehlen)', '', 'Qualität der Beratung:', 'sehr zufrieden (Sehr ausführlich)', '', 'Mediz. Behandlung:', 'sehr zufrieden (Ist alles bestens abgelaufen)', '', 'Verwaltung und Abläufe:', 'sehr zufrieden (Sehr nett und freundlich)', '', 'Ausstattung und Gestaltung:', 'zufrieden (Toiletten und Duschen auf dem Flur für alle)', '', '', '']"
DIAKOVERE Annastift,Orthopädie,06.04.2018,Orthopädie nur hier ...,"['Hallo , in der DIAKOVERE  ANNASTIFT  , fühlte ich mich als Patient sehr gut aufgehoben . Die Ärzte und die Schwestern kümmerten sich Fachlich und auch Persönlich um mich . Ich bemerkte hier im Annastift , das alle Fachabteilungen sehr gut zusammen arbeiten . Auch vor und nach meiner OP wurde mir alles sehr ausführlich erläutert ( Knie OP )   Die Station , war auch sehr Ordentlich und vor allem sehr Sauber. Die Freundlichkeit und die Hilfsbereitschaft der Ärzte und der Schwestern fand ich Super im Annastift .']","['', '', 'Gesamtzufriedenheit:', 'sehr zufrieden', '', 'Qualität der Beratung:', 'sehr zufrieden', '', 'Mediz. Behandlung:', 'sehr zufrieden', '', 'Verwaltung und Abläufe:', 'sehr zufrieden', '', 'Ausstattung und Gestaltung:', 'zufrieden', '', '', '']"
DRK-Clementinenhaus,Chirurgie,12.03.2021,Einfach top,"['Am 01.3.2021 wurde mir die Galle entfernt. Das gesamte Team, von der Reinigungskraft bis zu den Ärzten war Top! Danke an die Anästhesie, ich hab mich sehr sicher und gut aufgehoben gefühlt.', 'Insgesamt würde ich das Clemi jederzeit weiterempfehlen und bin froh, dass ich mich für das Krankenhaus entschieden habe.', 'Jeder Mitarbeiter ist mir freundlich und zugewandt begegnet.', 'Danke für Alles.']","['', '', 'Gesamtzufriedenheit:', 'sehr zufrieden (Jederzeit wieder meine erste Wahl)', '', 'Qualität der Beratung:', 'sehr zufrieden (Sehr ausführlich)', '', 'Mediz. Behandlung:', 'sehr zufrieden (Alles super!)', '', 'Verwaltung und Abläufe:', 'sehr zufrieden (Alles gut koordiniert)', '', 'Ausstattung und Gestaltung:', 'sehr zufrieden (Alles sauber und ordentlich)', '', '', '']"
DRK-Clementinenhaus,Kardiologie,10.03.2021,Alles o.k.,"['Das Krankenhaus macht ein gepflegten und sauberen Eindruck. Zimmer und Verpflegung waren gut. Das Pflegepersonal war überaus freundlich und fach kompetent. Ich hatte nichts aus zu setzen, habe mich gut aufgehoben gefühlt. Weiter so!', 'Mein Aufenthalt war nur drei Tage. Es war alles in Ordnung. Die behandelnden Ärzte waren etwas kurz angebunden,das schließe ich auf hohes Arbeitsaufkommen zurück,sie waren aber fach kompetent und freundlich zu mir, im ganzen war alles sehr zufrieden stellen.']","['', '', 'Gesamtzufriedenheit:', 'sehr zufrieden', '', 'Qualität der Beratung:', 'zufrieden', '', 'Mediz. Behandlung:', 'sehr zufrieden', '', 'Verwaltung und Abläufe:', 'sehr zufrieden', '', 'Ausstattung und Gestaltung:', 'sehr zufrieden (sauber und neue Einrichtung,zentrale Lage, 2 Bettzimmer)', '', '', '']"
DRK-Clementinenhaus,Sr.Petra,02.01.2021,Mitarbeiter,"['Ich finde es äußerst frech das vereinzelte Mitarbeiter nicht akzeptieren wollen, das man eine freie Meinungsäußerung hat und hier meine negative Bewertung schön reden wollen. Sie haben ja die selbe Möglichkeit Ihren Saftladen gut zu bewerten. Meine Meinung und vieler anderer Kollegen auch hat hier nur mal eine Meinung geäußert. Diese hilft anderen um sich mal über die Missstände in der Pflege zu informieren. Die Rosarote Brille mal abnehmen! Und ja, in anderen Krankenhäusern ist es bestimmt nicht besser. Das ist ja das schlimme. Es gib nur vereinzelt, wenn überhaupt zufriedene Krankenpfleger und Pflegerinnen. Älteres Personal wird von den Jüngeren teilweise, wenn man nicht mehr so schnell ist, ausgegrenzt oder gemobbt.']","['', '', 'Gesamtzufriedenheit:', 'unzufrieden (Wie oben beschrieben im Text.)', '', 'Qualität der Beratung:', 'unzufrieden (Keine Zeit für Beratung.)', '', 'Mediz. Behandlung:', 'unzufrieden (Kaum Zeit für gute Behandlung.Zeitdruck,Stress,zu viele Patienten pro Fachkraft.)', '', 'Verwaltung und Abläufe:', 'unzufrieden (Abläufe werden immer stressiger,älteres Personal wird zu hohen Belastungen ausgesetzt.)', '', 'Ausstattung und Gestaltung:', 'unzufrieden', '', '', '']"
DRK-Clementinenhaus,Kardiologie,28.12.2020,Unzufrieden,['Leider während der Corona Zeit nicht so gute Erfahrung.'],"['', '', 'Gesamtzufriedenheit:', 'unzufrieden', '', 'Qualität der Beratung:', 'weniger zufrieden', '', 'Mediz. Behandlung:', 'weniger zufrieden', '', 'Verwaltung und Abläufe:', 'weniger zufrieden', '', 'Ausstattung und Gestaltung:', 'unzufrieden', '', '', '']"
DRK-Clementinenhaus,Orthopädie,27.12.2020,XD,['XD'],"['', '', 'Gesamtzufriedenheit:', 'unzufrieden', '', 'Qualität der Beratung:', 'unzufrieden', '', 'Mediz. Behandlung:', 'unzufrieden', '', 'Verwaltung und Abläufe:', 'unzufrieden', '', 'Ausstattung und Gestaltung:', 'unzufrieden', '', '', '']"
DRK-Clementinenhaus,Orthopädie,24.12.2020,"Rundum ""SORGLOSPAKET""; Empfehlenswertes Krankenhaus","['1.Vorbereitung OP durch Anästhesie:', '- hohe Professionalität bei EKG, Blutentnahme, Vorbereitungsgespräch und einer deutlich spürbaren   Empathie gegenüber dem Patienten, ', '- einen herzlichen Dank an das Vorbereitungsteam.', '', '2.Operation', '- ebenfalls eine hoch professionelle Vorbereitung, Durchführung (ablesbar an dem positiven Ergebnis der Op) und postoperative Begleitung durch den Operateur und der Anästhesie,', '- auch hier spürte man die Hinwendung zum Patienten deutlich,', '- herzlichen Dank an das Operationsteam.', '', '3. Pflege Station 4 A', '- hier fühlte ich mich als Patient, aber in erster Linie als Mensch, geborgen und sicher,', '- die verantwortlichen Pfleger-/innen waren wach, aufmerksam und zeigten dem Patienten gegenüber eine Hilfsbereitschaft, die man besonders hervorheben muss,', '- hier war nicht nur eine erkennbare Professionalität, sondern hohe Motivation in Verbindung mit Spaß am Beruf und daraus folgernd ein hohes und überdurchschnittliches Leistungsniveau ablesbar,', '- auch hier verbinde ich meine Aussage mit einem herzlichen Dankeschön.', '', '4. Infrastruktur, Ausstattung Patientenzimmer und Ernährung, ', '-  ich war ausgesprochen überrascht über die erlebte Hygiene, Sauberkeit, Modernität und technische Ausstattung der Klinik und insgesamt mit den vorhandenen sozialen Räumen und natürlich, aus meiner Sicht, den Patientenzimmern. Das alles bewegt sich auf einem sehr hohen Niveau,', '- die Verpflegungsangebote glichen einer sehr gut geführten Speisekarte, da fehlte nichts.', '', '5. Verwaltung', '- die Verfahrensabläufe sind mir zwangsläufig nicht bekannt. Trotzdem ist die Folgerung zulässig, dass in dieser sehr gut organisierten Klinik die Verwaltung einen nicht unerheblichen Beitrag leistet.', '', 'Insgesamt gebe ich dem Clementinenhaus die volle Punktzahl und die gerne gesehenen 5 STERNE.']","['', '', 'Gesamtzufriedenheit:', 'sehr zufrieden', '', 'Qualität der Beratung:', 'sehr zufrieden', '', 'Mediz. Behandlung:', 'sehr zufrieden', '', 'Verwaltung und Abläufe:', 'sehr zufrieden', '', 'Ausstattung und Gestaltung:', 'sehr zufrieden', '', '', '']"
DRK-Clementinenhaus,Verstoß melden,15.12.2020,Unzufrieden,"['Genervtes Personal, ganz besonders 3 Schwestern.']","['', '', 'Gesamtzufriedenheit:', 'unzufrieden', '', 'Qualität der Beratung:', 'weniger zufrieden (Ärzte kaum gesehen.)', '', 'Mediz. Behandlung:', 'weniger zufrieden', '', 'Verwaltung und Abläufe:', 'weniger zufrieden', '', 'Ausstattung und Gestaltung:', 'weniger zufrieden (Zimmer zu eng und dreckig)', '', '', '']"
DRK-Clementinenhaus,Verstoß melden,02.12.2020,Mobbing,['Kollegenschweine sind überall unterwegs. Leitung kümmert sich nicht korrekt. Man sei selber Schuld an der Situation. Ungerechtigkeit hoch 3 .'],"['', '', 'Gesamtzufriedenheit:', 'unzufrieden', '', 'Qualität der Beratung:', 'unzufrieden', '', 'Mediz. Behandlung:', 'unzufrieden', '', 'Verwaltung und Abläufe:', 'unzufrieden', '', 'Ausstattung und Gestaltung:', 'unzufrieden', '', '', '']"
DRK-Clementinenhaus,Verstoß melden,01.12.2020,vorbildlicher Ablauf einer HernienOP hinsichtlich med. Versorgung und Betreuung,"['Hernien OP - perfekter Ablauf hinsichtlich med. Versorgung und Pflegebetreuung, danke für alles, andere Kliniken in Hannover können sich ein Beispiel nehmen']","['', '', 'Gesamtzufriedenheit:', 'sehr zufrieden', '', 'Qualität der Beratung:', 'sehr zufrieden', '', 'Mediz. Behandlung:', 'sehr zufrieden', '', 'Verwaltung und Abläufe:', 'sehr zufrieden', '', 'Ausstattung und Gestaltung:', 'sehr zufrieden', '', '', '']"
DRK-Clementinenhaus,Chirurgie,28.11.2020,Chirurgie Station,"['Auf der Station von Dr. Strey sind alle Mitarbeiter sehr zuvorkommend und sehr  nett. Das ganze Personal sehr kompetent und immer für einen da. ', 'Ich würde diese Klinik/Station jedem sehr empfehlen. Man fühlt sich dort sehr gut aufgehoben.']","['', '', 'Gesamtzufriedenheit:', 'sehr zufrieden', '', 'Qualität der Beratung:', 'sehr zufrieden', '', 'Mediz. Behandlung:', 'sehr zufrieden', '', 'Verwaltung und Abläufe:', 'sehr zufrieden', '', 'Ausstattung und Gestaltung:', 'sehr zufrieden', '', '', '']"
DRK-Clementinenhaus,Orthopädie,28.11.2020,"RM-Läsion,Impingement rechts","['Ich bin vom Clementinenhaus begeistert! Kompetente', 'Ärzte und sehr freundliches Klinikpersonal!Fühlte ', 'mich bestens aufgehoben.Absolut empfehlenswert!!', 'Woanders konnte mir niemand weiter helfen.....']","['', '', 'Gesamtzufriedenheit:', 'sehr zufrieden', '', 'Qualität der Beratung:', 'sehr zufrieden', '', 'Mediz. Behandlung:', 'sehr zufrieden', '', 'Verwaltung und Abläufe:', 'sehr zufrieden', '', 'Ausstattung und Gestaltung:', 'zufrieden', '', '', '']"
DRK-Clementinenhaus,Gastrologie,17.11.2020,OP bringt nichts,['Magenband OP anders als erwartet.'],"['', '', 'Gesamtzufriedenheit:', 'unzufrieden', '', 'Qualität der Beratung:', 'unzufrieden', '', 'Mediz. Behandlung:', 'unzufrieden', '', 'Verwaltung und Abläufe:', 'unzufrieden', '', 'Ausstattung und Gestaltung:', 'unzufrieden', '', '', '']"
DRK-Clementinenhaus,Geriatrie,06.11.2020,Covid,['Keine Covid Tests für Personal .....'],"['', '', 'Gesamtzufriedenheit:', 'unzufrieden', '', 'Qualität der Beratung:', 'unzufrieden', '', 'Mediz. Behandlung:', 'unzufrieden', '', 'Verwaltung und Abläufe:', 'unzufrieden', '', 'Ausstattung und Gestaltung:', 'unzufrieden', '', '', '']"
DRK-Clementinenhaus,Chirurgie,29.10.2020,Wiedererlangung von Lebensqualität,"['Strukturierte Eingangsuntersuchung. Der Vorgabetermin', 'wurde exakt gehalten. Freundlich während der ver-', 'schiedenen Gespräche.', 'All machten einen kompetenten Eindruck.Fühlte mich ', 'gut aufgehoben.']","['', '', 'Gesamtzufriedenheit:', 'sehr zufrieden', '', 'Qualität der Beratung:', 'sehr zufrieden', '', 'Mediz. Behandlung:', 'sehr zufrieden', '', 'Verwaltung und Abläufe:', 'sehr zufrieden', '', 'Ausstattung und Gestaltung:', 'zufrieden', '', '', '']"
